,Title,Author,Created,Comments,Score,Upvote,Edited,Url,Body
102,FDA approve test that can generate a positive COVID-19 result in just minutes; negative results in 13 minutes.,atjones6,1585389711,359,7521,0.98,False,https://www.forbes.com/sites/brucejapsen/2020/03/27/us-approves-abbott-labs-five-minute-rapid-coronavirus-test/,
103,Airlines Ordered to Pay Refunds for Flights Canceled by Virus,bloomberglaw,1585965503,307,7507,0.99,False,https://www.bloomberg.com/news/articles/2020-04-03/airlines-ordered-to-pay-refunds-for-flights-canceled-by-virus?sref=n7sPqZ0g,
104,YouTube to suppress content spreading coronavirus 5G conspiracy theory,Zhana-Aul,1586128393,844,7492,0.97,False,https://www.theguardian.com/world/2020/apr/05/youtube-to-suppress-content-spreading-coronavirus-5g-conspiracy-theory,
105,Anonymous donor gives every household in a small Iowa town $150 in gift cards,into_the_space,1586606112,156,7386,0.98,False,https://www.cnn.com/world/live-news/coronavirus-pandemic-04-11-20/h_7e057ebdfdf0dde0ae5b1b113019685f,
106,Some anti-vaxxers are changing their minds because of the coronavirus pandemic,maxwellhill,1587414173,586,7383,0.96,False,https://edition.cnn.com/2020/04/20/health/anti-vaxxers-coronavirus-intl/index.html,
107,‘He just got better and better’: 104-year-old veteran beats coronavirus in time to celebrate his birthday,-Kerosun-,1586552952,129,7318,0.97,False,https://www.washingtonpost.com/nation/2020/04/03/veteran-survived-coronavirus/?outputType=amp,
108,Governors across the nation slam federal coronavirus response: ‘We didn’t take this seriously’,Demonfire99,158493377,489,7253,0.96,False,https://www.cnbc.com/2020/03/22/governors-say-they-are-not-getting-supplies-they-need-for-coronavirus.html,
109,French study finds hydroxychloroquine doesn't help patients with coronavirus,Zhana-Aul,1586998097,740,7207,0.95,False,https://edition.cnn.com/2020/04/15/health/new-french-study-hydroxychloroquine/index.html,
110,Nike is closing all of its stores in the US because of the coronavirus outbreak,albhed,1584300479,267,7212,0.99,False,https://www.cnbc.com/2020/03/15/nike-is-closing-all-of-its-stores-in-the-us-because-of-coronavirus.html?__source=twitter%7Cmain,
111,Sailor aboard USS Theodore Roosevelt dies of coronavirus,idunmessedup,158681249,52,7161,0.98,False,https://www.cnn.com/2020/04/13/politics/theodore-roosevelt-sailor-coronavirus/index.html,
112,Confirmed Coronavirus Cases Is an ‘Almost Meaningless’ Metric,KnownNormie,1585520082,546,7134,0.97,False,https://www.bloomberg.com/opinion/articles/2020-03-28/confirmed-coronavirus-cases-is-an-almost-meaningless-metric,
113,"New York governor: ""We are past the high point and all indications at this point is that we are on the descent""",into_the_space,158734306,725,7105,0.98,False,https://www.cnn.com/world/live-news/coronavirus-pandemic-04-19-20-intl/h_e050710831635380922cc52ac19743d1,
114,3M CEO: Our medical masks should not be showing up in stores,osa89,158502159,325,7096,0.99,False,https://www.cnn.com/2020/03/23/business/3m-ceo-n95-masks-target/index.html,
115,An ER doctor dies in his husband's arms a week after first coronavirus symptoms,AhavaKhatool,1585846499,282,7081,0.96,False,https://www.cnn.com/2020/04/02/us/emergency-room-doctor-dies-coronavirus-husbands-arms/index.html,
116,"These ‘disease hunters’ developed a novel technique for tracking pandemics after 9/11, but lost funding right before COVID-19",Sarbat_Khalsa,1586040599,204,6955,0.97,False,https://www.cnbc.com/2020/04/04/syndromic-surveillance-useful-to-track-pandemics-like-covid-19.html,
117,A 102-year-old Italian woman recovers from coronavirus,Pun_isher,1585381597,155,6946,0.98,False,https://www.cnn.com/world/live-news/coronavirus-outbreak-03-27-20-intl-hnk/h_5918ca3847643824cacb89755b89abd2,
118,Police officer under investigation after video appeared to show him openly coughing at black residents,profkimchi,1586374665,461,6911,0.96,False,https://www.washingtonpost.com/nation/2020/04/08/baltimore-cop-cough-coronavirus/,
119,"Coronavirus pandemic could inflict emotional trauma and PTSD on an unprecedented scale, scientists warn",DoremusJessup,1585390584,643,6876,0.97,False,https://www.cnbc.com/2020/03/27/coronavirus-pandemic-could-inflict-long-lasting-emotional-trauma-ptsd.html,
120,"NYC Mayor tells New Yorkers to cover their faces when they go outside, even if it’s a homemade mask, reversing previous guidance advising only those who are sick wear face masks.",redlollipop,1585894261,653,6856,0.99,False,https://www.cnbc.com/2020/04/02/coronavirus-nyc-mayor-de-blasio-urges-new-yorkers-to-cover-face-with-scarves-or-bandanas-when-outside.html,
121,A surgeon who was evicted by his landlady because she feared she would get coronavirus has set up a website to help NHS staff find accommodation.,Artemis_Eve,1585857666,220,6847,0.98,False,https://www.bbc.co.uk/news/uk-england-oxfordshire-52132079,
122,"Lego is producing 13,000 face visors a day for healthcare workers amid coronavirus pandemic",glennjersey,1586900172,125,6780,0.99,False,https://www.usatoday.com/story/money/2020/04/10/coronavirus-lego-producing-13-000-visors-day-healthcare-workers/5135078002/,
123,Surgeon General: This week will be like a 'Pearl Harbor' and '9/11' moment,Fubar904,1586124659,1011,6735,0.97,False,https://www.cnn.com/2020/04/05/politics/jerome-adams-coronavirus/index.html,
