,Title,Author,Created,Comments,Score,Upvote,Edited,Url,Body
0,They knew?,yungchewie,1585043007,16,24,0.83,False,https://i.redd.it/fk0jvlhhzio41.jpg,
1,Covid-19: Coverup for Economic Collapse,lukenishihama,1584955881,7,25,0.89,1585101372.0,https://www.reddit.com/r/Covid19Conspiracy/comments/fnbhdt/covid19_coverup_for_economic_collapse/,"We're being lied to about this virus through a guise of government propaganda. This relatively benign and newly discovered pathogen was invoked to keep us compliant during the biggest crash in economic history. A virus with a mortality rate incomparable to the plethora of epidemic diseases due to its statistical harmlessness (80% of the population have mild to no symptoms) would never cause a total shutdown of the world economy in previous history. People need to lift the veil of fear and anxiety to come to realise that the real damage arises from the manipulation of human emotion -  leading us down a path devoid of personal freedom. With our blame pointed at the millennial population and children as culprits of transmission to the elderly,  the government hopes to create a political divide between millennial and senior voting populations.
 In these turbulent times we must be very cautious and question authority in order to maintain control of our democratic freedoms. Don't believe until the truth is presented.  Don't follow until the light guides you."
2,CONVENIENT TIMING OF COVID 19,QuaesitorSapientiae,1584795642,6,24,0.92,1584767475.0,https://www.reddit.com/r/Covid19Conspiracy/comments/fm9qj5/convenient_timing_of_covid_19/,"There has been a lot of convenient timing and coincidence surrounding the covid 19 virus pandemic

1. Trump deals with India on moving trade from China to India (December)
2. Trump threatens current trade deals with China
3. China deals with Italy, Iran, Spain, France, Germany (all hit hardest by virus) on new trade deals (December)
4. Kobe died with a week of going to court against pharma in China (December)
5. Bill Gates purchases patent of covid 19 (December)
6. Bill Gates Ted Talk on a new threat in 2016 (viruses)
7. 2020 Election coming up and all of a sudden the economy is doing poorly because of Trump

let me know if I shall continue and go into further detail"
3,Gov’t test run,violet_wraith33,1584610616,7,23,0.9,False,https://www.reddit.com/r/Covid19Conspiracy/comments/fl1ikm/govt_test_run/,"It feels like the government is testing us to see how compliant we will be ; like this is a soft run on immuno-warfare. Survival of the fittest, crowd control. 🧐"
4,Whole thing does seem a little fishy don’t it,Affflackk,1585137422,4,18,0.86,False,https://i.redd.it/ge65nnk8sqo41.jpg,
5,Something's going on..,tllnz,1586676574,4,16,0.94,False,https://www.reddit.com/r/Covid19Conspiracy/comments/fzli8f/somethings_going_on/,"Does anyone really believe the mainstream propaganda? I don't...Definitely ""Danger Will Robinson!"" But Something else is going on, probably much much scarier."
6,Eerily similar covid19 beginnings to the Handmaid's Tale,Zephy_Louboutin,158530119,9,17,1.0,False,https://www.reddit.com/r/Covid19Conspiracy/comments/fpo0mw/eerily_similar_covid19_beginnings_to_the/,"I've been drawing some similar parallels between the Covid19 outbreak and Handmaid's Tale.... These are some of the things that have made me double take in Australia... 

~ ONLY essential workers children having access to education and child care

~ I haven't heard of legitimately one person who wasn't a person of status contracting Covid19

~ we've been isolating for about 3 weeks now and we are still seeing a huge rise in *covid19 cases*

~ proposal of supermarkets staying open 24/7, despite financial aid helplines and centres not, the lines are not even ringing and but just connecting and saying *Thank you, goodbye* and hanging up. The online applications ping pong you between each other saying you need to fill out a certain form on the other application (neither work)

~ bizarre snap changes of *new social distancing enforcements* hair dresser appointments being limited to 30 minutes for literally 24 hrs, then being reverted to regular trade.

~ everyone being scared into buying hoards of toilet paper?

~ coffee shops remaining open? <this weirds me out, I'm a barista and am thankful for the income but really? >

~ how quickly China recovered from Covid19.

~ being told to stay home, yet every man and his dog is out and about (more than usual)

~ confusing, long winded mandatory broadcasting of *Covid19 updates* that are convaluded, and really have nothing new to report.


~ petrol prices so low?

Please keep in mind I have labelled this as a conspiracy, and I am open to all new ideas! It's just spooky.

What do you guys think?"
7,"I’m just a CPA, but...",braesmamma,1585137403,4,17,1.0,False,https://www.reddit.com/r/Covid19Conspiracy/comments/fojpro/im_just_a_cpa_but/,"I have to put all of these thoughts I’m having somewhere so here it goes:

From the “crazy CPA”

The Coronavirus started as a virus in China in roughly November. Been worried about it since, because of how fast it spread. I don’t care where it originated, that’s irrelevant today.  But like any virus, the virus spreads to others. And in this case we knew it was highly contagious and likely would spread very fast. The flu is a virus and spread this way in 1918 and continues to infect people today even though we have a vaccine. Vaccine does not equal a cure. So the world sees a virus in November and knows it’s

1.  Highly contagious 
2. Easily transmissible 
3. Asymptotic for a period of time and completely for some 

This was not hidden by the Chinese from us. It was news then, all you had to do was read CNN, Yahoo or shoot even Fox News. A virus is breaking out in China that spreads!!! Hmm, a logical brain tells a logical person, especially in 2019-2020 that at least one person got out. I mean, I’ve watched Contagion!!!  

But the rest of the world didn’t care. I mean it’s just a virus, how bad can it get?? 

At this stage - 2 worlds are starting to collide.  Health/Science and Economics. 

The scientists start saying “this shit is bad” and the money people start saying “but we cannot shut down over a virus! I mean, who does that? It’s ludicrous”. 

Only going by what I read, but when I read a report that the head of HHS brought up the Coronavirus in a meeting with president Trump in January and he responded by cutting him off to ask when we could start selling flavored vape products?? 

We all already know what he said in public about it, not going there and don’t care to. It’s irrelevant today. 

That’s mid-January. We already know there’s a highly contagious virus, that’s likely spreading the globe that is asymptotic in some people who are still spreading the virus and in others they get sick, especially in elderly or those with underlying conditions. I’m an accountant and I knew about this virus. Just as my daughter who is also a nurse - she was getting tired of her hypochondriac Dad talking about this Coronavirus. I wasn’t being paranoid, I simply was playing a numbers game. I’m not a genius and never will be, but I think logically. It was coming here eventually. 

Cases started happening more and more around the globe and you start wondering, wow this has to get here, it’s logic. Common sense!!!

See this is a virus, just like the flu is a virus. We have a vaccination for the flu not a cure. Thousands die every year of the flu, including those who have been vaccinated. As a client said, a virus the world has never seen, that spreads fast and sort of hides itself. This wasn’t hidden from anyone, including those in charge, they simply failed to act. That’s the sad part. But not just America, other countries as well. We simply put the almighty dollar before human lives. I’m a CPA so I understand that, however we are now feeling the brunt all over the world. And for that I’m sad for humanity. 

As I’ve said several times in the past day, humans are selfish by nature. We all are, admit it. We want to protect ourselves and our loved ones. I do, so do you.  However, because of that it will cost us now and in the future. 

Our leaders should have put a plan in place starting in January when they knew it would make its way here. It’s  science, biology logic...just common sense. Instead we did what we always do with problems that may affect us negatively, we ignored them. That decision  will cost us now and in the future. 

We knew about a problem and ignored it. I’m not blaming anyone, but inaction is causing the crisis, not the virus itself. Because I know of healthcare people who were and still are simply ignoring it until they have no choice. 

I got an email from a client in Indiana. She tested positive today. She’s been sick for a week. A week ago they said there are no positive cases in our county, so here’s some TamiFlu, and sent her on her way. Problem was several were symptomatic and were not being tested. Did you travel outside the country? Were you around anyone who is a confirmed positive?  Isn’t there always a first?  First in country, state, county, city,
town, village?  Numbers never lie. She tested positive today, a week later!!!  Been around a lot of people. Her comment: doctors offices are receiving 200 calls with the same symptoms.  Hmm, wonder what they have?? Again, logic. Not hard. 

My daughter tested presumptive positive on Saturday, told to go home quarantine for 14 days, then 14 days after symptoms subside, then 2 negative tests. Ok. By the time she got home the rules had changed. Once symptom free for 72 hours you are good. Is anyone catching on yet?  When a new virus appears that we know nothing about, people start changing rules as we go. Funny how the CDC said today, a cruise ship that was empty for 17 days still has live virus. So how do they really know?

Now, daughter gets results back in 48 hours when she was told a negative test takes 7 days to truly show no virus. I know testing was getting better, but who tested the testers??  Hmm, logic again. She tested negative and when asked what she had then, likely a virus that has THE EXACT SAME SYMPTOMS!!! Thats scary. She has a super dry cough, low grade fever, more exhausted than ever, shortness of breath.  That checks every box of what I have looked at as symptoms for a 25 year old. Which not sure how they have put the data of which age groups have what symptoms, there is not enough data to satisfy me. But she’s negative on a new testing system they just started. Again, logic tells me they have no clue what’s going on. 

That’s all the science. Now to the fiscal part. People need their jobs and businesses need to stay afloat. So instead of worrying about this virus, we all just kept plugging along. Thinking- I can’t close my business because of a virus. I need my paycheck, boss says we are open, I have to go to work, even though I’m a little worried. 

So here we kept going along like it wasn’t going to affect us. I was the first business in my town to close to the public and I’m a PUBLIC accounting firm. I have been damn near laughed out of office for saying NCAA might be cancelled. That was 2 weeks before it happened.  I’m just an accountant everyone, not a rocket scientist. If our administration doesn’t have people much smarter than me who knew this, we are all screwed. 

And here we all sit wondering how we will get our paychecks, pay our bills, pay our employees. Still, right now. I have clients, employers, employees panicked. These are businesses of all types, we are all affected.  I have read the senate bills and the house bills, this will be the single biggest amount in HISTORY. And we are haggling over planned parenthood. 

All sports are cancelled, they cancelled the Olympics, cancer patients have been put on hold, Vegas is closed and we are talking about getting back business by Easter???  Is that a joke? Anyone remember anything like this? Again, logic/common sense. Not hard to see. 

These bailouts basically appear to pay us to stay home until June. I suggest we all do. Stay in, ride it out. Be responsible and compassionate to each other. Do your part. 

But I want everyone to remember it wasn’t one party or they other that failed us. It is ALL OF THEM. 

We are talking about people who were getting briefed about this virus who went and sold stocks after. Both parties, BTW. These are also the same people who knew how serious it was because they were worried about their money who then shook hands with each other, ate lunch together and in one case was in a gym with people when all gyms across most of country were closed. Now the senate can’t have a full vote and the house is “now” scared of it. These are our leaders folks. Remember that. They are idiots who have no idea what all of us go through on the daily grind of life. They sit in their ivory towers and play us like pawns against each other. 

NO MORE. 

We must unite, make it through this and get real people who actually care and will guide us. 

They all missed the boat on this one, ALL OF THEM.

Be safe. 

From the crazy CPA."
