,Title,Author,Created,Comments,Score,Upvote,Edited,Url,Body
8,COVID isn't scary. What people are doing right now is scary.,mindputty,1585733757,19,14,0.76,False,https://www.reddit.com/r/Covid19Conspiracy/comments/fsq0e8/covid_isnt_scary_what_people_are_doing_right_now/,"**TL;DR: Money is driving Covid-19 panic/overreaction. Investors will get richer. Everything will go back to normal. Don't be a Covidiot. Don't give away your rights and freedoms. 1% of our already-sick grandparents may die, but they were probably going to die this year anyway, covid or not.**

Something's going on. Exactly what, I have no idea. The really odd thing that worries me the most is the lack of dissenters and free thinkers who have some sort of differing opinion. The fact that people will disagree is a universal given, yet it's as if the whole world, whether at the governmental or personal level, is all speaking in unison, which is terribly worrying, though perhaps to be expected, knowing human psychology. 

I could be completely wrong, and I have grappled with the consequences of leading people astray with incorrect opinions (what if I'm wrong and I affect people's behavior and someone contracts the virus that otherwise wouldn't have?). Take what I have to say with a grain of salt and make your own decision. Having said that, here's what I think. 

Even faster than the spread of the disease was the spread of the information that alerted to the world of this horrible virus that was touted as worse than all others to come before. The response was unusually fast and the quickness that governments, the WHO, and others to agree and take action was unprecedented. You'll see news stories telling you the exact opposite, but it's are BS -- we are moving EXTREMELY quickly on this. Governments and bureaucracies are always INCREDIBLY slow to take action, especially with so little confirmed evidence, and yet the response spread FAST, and countries decided to take HUGE economic hits that they would never do.

So much of the seriousness on the matter HINGES on us accepting certain facts to be true. Specifically, we MUST believe that Covid is *much deadlier* than regular seasonal flu. I believe that we will see that it is extremely comparable to regular seasonal flu. There are some sources now (months after the initial panic), that are warning us that the death rate is likely grossly over-exaggerated.  [https://www.msn.com/en-ca/news/world/utterly-unreliable-the-mystery-behind-the-true-covid-19-death-rate/ar-BB11Y3e4](https://www.msn.com/en-ca/news/world/utterly-unreliable-the-mystery-behind-the-true-covid-19-death-rate/ar-BB11Y3e4) As with other viral outbreaks, such as SARS, MERS, etc. The initial death rate is touted as higher than the actual death rate that is seen in the end. There's several reasons to believe that the numbers we're seeing are grossly off:

Selection bias. We are only testing those who are gravely ill or who need hospitalization. One theme in many news stories is how testing is restricted. They are controlling the numbers so that they can continue to report x / y, keeping the y as selective as possible so that the percentage is as high as possible. We are exclusing from y all of the mildly symptomatic or asymptomatic. Some sources claim that we are off by a factor of 30x. That would mean that the actual death rate is less than the seasonal flu. The WHO claims that 650,000 people die yearly from influenza. I predict we will see far fewer deaths from covid-19 than from influenza. This seems like a bold claim to make given how quickly it has exploded, but it's exactly because of its quick explosion that I think it will  be less severe. We know that the virus is especially harmful to those with compromised immune systems and those with comorbidities / preexisting conditions. In fact, of all the deaths in Italy, only 12% of the deaths were attributed to the virus alone, while the rest of the patients had either 1, 2, 3, or more conditions already. We don't know the numbers or the science. That takes time, but we're rushing towards these conclusions because someone is spamming the panic button. It doesn't make sense for you to say that ""coronavirus killed him"" when he already had cancer, diabetes, liver failure and caught covid-19 in his final days. And yet, that's exactly what's happening in Italy, where we're getting all of the nasty statistics from. And those statistics are brought up again and again. Another thing that's brought up again and again is how ""young people aren't immune, either"". Well, no, they aren't, but nobody is. The incidence of young people getting sick is and will continue to be extremely rare. Yet, the way that those rarities are touted by the media is shocking - as if they are boosting the rare to make it look more normal than it is. Take this story for example, which is shameful -- the entire crux of the article is ""he died and he was young"".  [https://www.msn.com/en-ca/news/world/teenage-boy-dies-in-london-after-testing-positive-for-coronavirus/ar-BB11YMfM](https://www.msn.com/en-ca/news/world/teenage-boy-dies-in-london-after-testing-positive-for-coronavirus/ar-BB11YMfM) Someone is seriously trying to push a narrative here. 

Any virus has a reproduction number - if 1 person gets it and spreads it to 2 other people, that rate is r=2. If R is exactly 1, it will carry on, one person at a time through the entire population until everyone has had it. Yet, that doesn't happen. If there is an R of 0.86, the virus will die out because on average, it's being spread to fewer than 1 person per person. That 0.86 is an *average*, at one *specific point* in time. Some people will spread to whole-units of people, while some will spread to 0. However, the important thing about R is that it is time-sensitive, and changing. If it were static, the first person who had a virus with R=0.86 would never pass it to anyone else, because someone can't spread it to 86% of one person (in reality, it's dealing with real whole integers of people - you can't pass it to 0.86 persons. It has to be 1 or 0 (or more than 1)).  In the beginning of any virus, without a vaccine, it will spread at a higher rate than later in its lifecycle, because of growing immunity, thinning of population, etc. Right now, the numbers are high because it's new and spreading and those numbers are being shouted from all the news outlets. That spread rate *will go down*. In order for a virus to spread at all through a population, it has to, by definition, have an R greater than 1 in the beginning, probably much higher than 1 (perhaps similar to the 2.3 being reported for covid...?).

Perhaps, just maybe, there is also a certain percentage of the population who is ""destined"" to die each year from contracting a disease because their immune system just won't be able to handle it (I say destined, but I don't really mean destiny or karma -- I mean they simply aren't healthy enough to make it with a reasonable degree of certainty, statistically speaking). Let's say that's 1%. Now, if coronavirus is particularly communicable, it will spread quickly, and let's say that it has. This means that a very large part of the population has contracted it already and a large percentage of that 1% (let's say half of the 1%, or 0.5%). Because they all got it at once, the numbers right now look really grim and that it will tear through the population, killing huge numbers of people. It might. It also could be, in reality, that it has a lower death rate than regular seasonal flu, but that everyone got infected in a short people of time / at the same time. This explains the burden that we see on hospitals, and \*does\* cause more deaths than would have been expected if the 'curve was flatter'. However, those numbers of deaths are a fraction of a fraction, and people would probably think that you're a kind person, but a bit insane if you were to suggest that the entire population be quarantined in their homes and that we throw half of the yearly budget for the entire nation down the drain to prevent a few extra seasonal flu deaths. Sounds cruel, perhaps, but that's what politicians and policy-makers are doing all the time. If you spend a dollar to save person A, it typically means that person B will die because they didn't get that dollar. Legislators *know* this. If you boost spending towards cancer research, that means that a different social program had to be cut to do it -- perhaps it was the suicide hotline. Right now, the US has approved giving away **2 of its 3.8 Trillion dollar yearly budget** to Americans.  That's over 52% of the entire budget, which is meant to go towards everything from those suicide hotlines, to road repair, research and development, building new infrastructure, trying to keep failing oil and vehicle industries alive, saving the environment, (and the list goes on and on) . Think that's coming out of the defense budget? Ha! Each American will receive about 1200 dollars. That's like chopping off your leg in order to self-cannibalize because you're starting to feel hungry. [https://www.nytimes.com/2020/03/27/world/coronavirus-live-news-updates.html](https://www.nytimes.com/2020/03/27/world/coronavirus-live-news-updates.html) 

That money is \*needed\* to keep the economy going, and they're not putting that coal into the furnace - they're giving it to individual Americans so that they can afford what amounts to, perhaps *a month or two* of rent. That's it. What happens then? That's sheer LUNACY, when the *real* problem is that we're all forced to stay at home, when thousands and thousands of people are out of jobs and the economy is slowing to a halt. An economy ***needs*** a certain percentage of its budget to continuously be reinvested as fuel to keep itself going. It needs its population at work to keep the fire going. Throw away too much of that fuel, and it doesn't have the momentum to keep going -- ironically, just like the infection rate, R above, if it's too small, it simply dies out. Wars stimulate economies because everyone goes to work. Economies die if everyone stays at home.

So we have this virus that is doing exactly what every virus does -- starts off strong, and will weaken over time. And yet we have all these people pumping it up, making it out to be deadly, an epidemic, now a pandemic (the seasonal flu is also a pandemic, ya know). ""We need to rush, together, towards this single-minded solution."" WHY? Why are we all being fed this doom and gloom? It's ***all*** predicated on bad statistics (manipulated or badly calculated death rates), and the numbers that are being reported in the media can be explained in a ***number*** of ways (one report that I saw also pointed to the fact that Italy had a particularly light year in terms of influenza infections, so its population was more rife for a different cause of death, which explains why they are an outlier among all countries). But the SPEED with which we rush towards this and the conformity of policy (there were some at first, but they have backtracked) is, as has been pointed out, unprecedented. Unprecedented things typically aren't great. The status quo is great.

**The scary part isn't the virus itself.** I think the virus can be explained by the above, and that it really is just like influenza with a higher transmission rate. It's not genetically engineered. It's not a weapon. It's just a run of the mill virus. But it might be an opportunity that's being seized upon. The scary part is that we're all collectively accepting that we need to do whatever the government says and go into destroy-our-own-economy-mode. I guarantee far **far** more people are going to die from our poor decision making panic at the moment, than due to the exceptional deaths due to our unprepared medical system couldn't prevent because it was overwhelmed. What's scary is how governments are enacting emergency measures without any kind of oversight, like Canada's (usually) democratic process that rushed through the ability to just spend whatever they need, indefinitely, of taxpayers' money (don't worry, we \*promise\* to spend it wisely, even though there's no vote on how it's used anymore, for as long as we say so). Or in China where the government is not being transparent at all about how **exactly** it makes a determination of which citizens are allowed to associate and move about freely using color-coded self-imprisoning (""isolating""...?) apps. It's UTTERLY draconian and worse than Orwell could have imagined in 1984  [https://thenextweb.com/china/2020/03/03/chinas-covid-19-app-reportedly-color-codes-people-and-shares-data-with-cops/](https://thenextweb.com/china/2020/03/03/chinas-covid-19-app-reportedly-color-codes-people-and-shares-data-with-cops/) . 

Or I could be wrong. 

Are there groups interested in burning everything to the ground -- of pushing us towards this ridiculous cut-off-your-nose-to-spite-your-face strategy? Perhaps, though more likely is what it always is: money. I'm willing to bet that what you'll see is that everything will return to normal in a matter of a couple of months (despite those who say it will drag out until at least 2022). During that time, stock prices will fall even further, while certain parties will keep buying those up. It's a perfect plan -- you don't have to actually kill anybody (any more than the seasonal flu already would have). All you have to do is control the media, spin everyone into a panic, and make people believe that it's the end of the world, juuuust long enough to buy what you want, then it all resolves without a hitch because of the great work everyone did in responding so quickly (i.e. we will never know if it stopped because of our intervention and ""self-isolations"", or because it *never would have been* a big deal in the first place). The stock price goes back to ""normal"", and you make a sweet sweet 30% on the market. 

Who could pull it off? The media, for one. It's a vicious circle -- the more afraid a person is, the more they listen to the media. We might see the investors and owners of media companies become extraordinarily rich in a few months (as if they weren't enough already). Amazon is **booming** at the moment (relatively speaking, which is all that matters in a game of comparisons). The media companies themselves will do well -- people are FORCED to stay at home and watch more tv, more Netflix, more msn news, more google ads. 

Another side-effect? Big polluters are being given carte-blanche -- they don't need to account for their sins for an indeterminate amount of time while this is happening. Nor do they even need to adhere to any of the rules. Go ahead and dump it all!

Or I could be wrong. We could be doing all the right things to stop the spread of a deadly virus. At a reasonable price/sacrifice.

Whether I'm right or only slightly right, or way off, we **NEED** to be super wary of giving up our rights and freedoms. Fear will make people lose their minds and makes otherwise unthinkable surrender of freedoms seem like a reasonable price to pay to stay alive. Remember: would we act this way if the ""death rate"" was only 1.5% lower (0.5%, i.e. the flu, as compared to 2%)? Never in a million years! How did 1.5% lead us to this (**IF** it's even that high)? I expect this to affect us less than the annual 650,000 deaths from influenza, especially now that we're exiting viral season. Only time will tell. I could be wrong.

Don't be a Covidiot."
9,Donald J. Trump,McDermond,1585698761,7,12,0.88,False,https://www.reddit.com/r/Covid19Conspiracy/comments/fsfclv/donald_j_trump/,"is a motherfucking idiot. He/WH staffers knew COVID-19 was big trouble in January.  DJT did nothing but lie. Six weeks passed as he declared that it was no big deal. He asserted that the virus would vanish in the spring due to warmer weather. He insisted it was a ""Democrat hoax"". Etc. FOX News was right with him, inventing conspiracy theories and distributing mis/dis-information. Then the World Health Organization declared COVID-19 a pandemic. Suddenly, FOX/DJT were forced to do a humiliating 180 and attempt revisionist history. Since his daily press conferences began, DJT has declared himself to be a ""wartime president"". There are now over 3 000 US deaths, more than Pearl Harbor and more than 9/11. Donald J. Trump cares more about his daily press-conference TV ratings than coronovirus deaths. Let that sink in."
10,"So.. It is my understanding that in this study, from 2007, Chinese scientists combined HIV with SARS to bind it to the ACE2 molecule in bats and humans.. Correct me if I'm wrong.",BanditMFG,1585066714,0,13,1.0,False,https://jvi.asm.org/content/82/4/1899/article-info,
11,Have we shifted dimensions?,porcaja,1586087232,5,11,1.0,False,https://www.reddit.com/r/Covid19Conspiracy/comments/fv7c6g/have_we_shifted_dimensions/,"I sincerely feel something larger at play here. Dimensional shift? Butterfly effect? What’s goin on? Thoughts, ideas, theories, let’s debate."
12,Interesting that Indiana Jones was was poisoned and needed an antidote. His friend Wu Han was the first killed. I know it's a stretch but odd all the same,RyanRebalkin,1585630672,1,11,0.87,False,https://v.redd.it/y53bwchuivp41,
13,Thanks to COVID-19 we have developed the largest collection of human blood samples in the history of humanity.,blessed_garden,1585388243,4,11,1.0,False,https://www.reddit.com/r/Covid19Conspiracy/comments/fqapoa/thanks_to_covid19_we_have_developed_the_largest/,
14,Conspiracy theories,McDermond,1584877146,0,12,0.85,False,https://www.reddit.com/r/Covid19Conspiracy/comments/fmt9cr/conspiracy_theories/,"While now may not be the time to dwell in conspiracy-theory-land, I have a few points. Let's hope we get to discuss at a later, healthier time.

The policy of ""social distancing"".

""Shelter-in-place"". 

The weakening of social structure. Loss of face-to-face communication. Incompetent leadership. Electoral campaigns. ""Cabin-fever"".

COVID-19 is the millennials 9/11. It is their ""before-then-after"" event. Nothing will be the same."
15,Food for thought.,Lou_suphar,1585400414,2,10,1.0,False,https://www.reddit.com/r/Covid19Conspiracy/comments/fqdqsp/food_for_thought/,"A quick look on flight radar really has me questioning the cries from the entirety of the aviation industry when there is basically a colony of ants still in the sky.
Could I presume a majority of these could be return flights for grounding?
I'm interested in what y'all may know.
Or what you'd like to speculate.

I was interested to see how and if the grounding of so many aircraft could alter our weather patterns."
16,Prisoners Testing Positive - Thoughts?,littlejeffyjeremy,1585359245,2,9,0.86,False,https://www.reddit.com/r/Covid19Conspiracy/comments/fq1ea6/prisoners_testing_positive_thoughts/,"I am curious to hear what y'all think:

I live in Texas, and raised an eyebrow when I heard a local prison had multiple reported cases of covid-19 before it had even really started to spread down here. This seems rather strange to me, though not totally unbelievable since a guard could have brought it in and since jails aren't the most sanitary places it could spread quickly and easily.

I got in my own head and started to look up other places that have outbreaks in prisons. There. Are. SO. Fucking. Many.

Like, it is sort of ridiculous how many prisons have outbreaks. And I get it, again unsanitary and they cram a lot of people into one space, but only about 5% (total statistical guess) actual leave the facility and then come back. What are the chances that a prison guard, a profession that a handful of people within a given area have, comes into contact with someone who has it? Seems pretty 'coincidental' to me.

The more rational part of me wants to say this may be false information, and a way of them halting introduction of new prisoners to the system since it is already overflowing and they may not have to spend so much on the prison system. The conspiracy theorist in me says they introduced it purposefully to clear out some cells.

&#x200B;

So, what do you think is going on?"
17,Why is the public radio silent?,FloatingToWonderland,1584949635,3,9,0.94,False,https://www.reddit.com/r/Covid19Conspiracy/comments/fn9vww/why_is_the_public_radio_silent/,"Am I the only one that has tried to find personal content about the virus from other countries? I am only faced with news sourced (mostly American news, china news, and bbc?) am I the only one who thinks its really f\*\*king strange that in a global pandemic with millions and millions of people involved- I can't so much as find a vlog from anyone.. anywhere in the world?"
18,"Not enough karma to post in /r/Showerthoughts. Since the COVID-19 quarantine, people are more likely to go on with the funky business. So we should see a spike in birth rates in around 9 months, depending on the area.",AnotherWeirdGuy,1584685822,4,12,1.0,False,https://i.redd.it/38pfvfnygpn41.jpg,
19,Hollywood silent on global pandemic?,idontcaregurl,1584446787,4,10,0.85,False,https://www.reddit.com/r/Covid19Conspiracy/comments/fjyt7c/hollywood_silent_on_global_pandemic/,Hollywood is pretty silent about COVID19... kobe dies and everyone goes nuts.. global pandemic happens... not a word ... suspicious
20,Is anybody talking about this?,lee1128,1586860192,8,8,0.8,False,https://i.redd.it/za1rd3nw2ps41.jpg,
21,Series of coincidences,ralcyst,1586250251,2,9,0.91,False,https://www.reddit.com/r/Covid19Conspiracy/comments/fwb07y/series_of_coincidences/,"New seed laws were placed in different states around the US, “vape disease” back in October 2019 is basically all the symptoms of Coronavirus (maybe the virus was man made here??). A lab in Maryland that supposedly created biological weapons (I can’t remember the name but you can google it) was shut down right around the whole vaping disease. Planes and military personnel/equipment is coming and going like crazy. Shit it getting real y’all, get some food and a kitana or some shit and bunker down."
22,Social Distancing in The Netherlands is going really great....,BanditMFG,1584825921,36,7,0.86,False,https://i.redd.it/g7teuf2w11o41.jpg,
23,Dutch Minister of Health collapses during live coronavirus debate,BanditMFG,1584638734,2,7,1.0,False,https://v.redd.it/0dhhg2p7lln41,
24,People are getting creative,BanditMFG,158462793,1,11,1.0,False,https://v.redd.it/hskyaix9njn41,
25,Dutch people are very poorly informed by their government when it comes to COVID19,BanditMFG,1584203103,9,10,0.86,False,https://www.reddit.com/r/Covid19Conspiracy/comments/fif9zm/dutch_people_are_very_poorly_informed_by_their/,"This is pretty sad... I just went to the Lidl (supermarket) to buy a few last things I needed: trashbags and toilet paper. Now, this supermarket is located in a shopping mall, 2 groceries, butcher, fish store, chicken store, etc, etc.. I was at the Lidl at 8am and it was already insanely crowded, shelves were already empty within a few minutes. What concerns me so much, is that I was the ONLY one wearing gloves, respirator and protection goggles. No one, but literally no one, was wearing any protective gear... People were standing close to each other, touching shopping carts, touching multiple products and then putting them back on the shelf... I even saw one guy coughing without even covering his mouth.. Then when in the line waiting till it was my turn to pay, took forever, the guy behind me said to me 'you're insane'. So I asked him 'why would you say that?' on which he replied 'your wearing a mask, but the RIVM (Dutch health organization) says masks are useless in public'... So I told him he's misinformed and that masks help protect from getting infected, the virus is airborne and can stay in the air for 30minutes. He started laughing and said 'haha, you're so scared for just the flu'. People still don't understand, that this virus, IS NOT THE FLU! DUTCH PEOPLE PLEASE WAKE UP! PROTECT YOURSELVES, DO NOT LISTEN TO WHAT OUR GOVERNMENT IS TELLING YOU!"
26,My theory on why this virus came about,Jay-mayday,1587226618,1,9,0.9,False,https://www.reddit.com/r/Covid19Conspiracy/comments/g3k35w/my_theory_on_why_this_virus_came_about/,"Think about it this virus is mainly killing  the older generation, so my theory is their not earning the tax man anything anymore so to lower population they (world leaders) have found a way to mutate pulmonary edema and turn it into this virus we have today. So the reason for this? Again just a theory but actually logically thinking about it is due to the fact the world eventually runs out of resources. This is why I believe war started in the first place throughout history and used religion as a excuse, not as many people are enlisting to serve so they had to come up with another way to lower population without the public knowing the real truth this is why the media covers it with false reports etc 

*governments biggest weapon is the media*"
27,Was the great vape scare of 2019 Covid19?,RetortNation,1587032323,2,7,0.76,False,https://www.reddit.com/r/Covid19Conspiracy/comments/g2664h/was_the_great_vape_scare_of_2019_covid19/,That seems to have completely disappeared
28,Hawaii,plaidandpaperplanes,1586454635,9,8,0.9,False,https://www.reddit.com/r/Covid19Conspiracy/comments/fxpnzd/hawaii/,"I live in Hawaii and ever since quarantine started, I’ve noticed an immense amount of helicopters flying around. Has anyone else noticed this anywhere out there or here? Lol."
29,The covid-19 test is also a convenient way to obtain everyone in the worlds DNA profile,karmapointsaregay,158620818,3,7,0.83,False,https://www.reddit.com/r/Covid19Conspiracy/comments/fvynvr/the_covid19_test_is_also_a_convenient_way_to/,
