,Title,Author,Created,Comments,Score,Upvote,Edited,Url,Body
32,Why is germaphobe Trump acting immune?,jpthoma2,1585132952,3,8,0.9,False,https://www.reddit.com/r/Covid19Conspiracy/comments/foip1h/why_is_germaphobe_trump_acting_immune/,"And his cohort does as well.  Do they have a cure?  Are they planning on locking down selling rights (maybe in partnership with Russia)?

Is this why they keep promising light is at the end of the tunnel?  A way to deliver a knockout blow to scientists and the media while controlling the production of the cure?


Naaaaah probably not."
33,Cant find a single positive Covid19 test result anywhere?!,htk1988,1584993294,47,8,0.9,False,https://www.reddit.com/r/Covid19Conspiracy/comments/fnipua/cant_find_a_single_positive_covid19_test_result/, Can anyone help me find a single positive test result for covid19 plz? if you or anyone u know has one could u cross out their personal info and show me what it looks like? i havent been able to spot any online. I cant find a single google image or pdf or instagram post or youtube vid.. How is this possible in the instagram era we live in?!
34,Senators sell their stock prior to COVID 19,motoko_4,1584886673,2,8,0.8,False,https://www.reddit.com/r/Covid19Conspiracy/comments/fmvary/senators_sell_their_stock_prior_to_covid_19/,Few senators sold some of their stock prior to the COVID 19 that plummeted the US economy. Clearly they knew something was up. . .why is testing taking so long here in the US?
35,21 million fewer cellphone users in China may suggest a high CCP virus death toll | China in Focus,BanditMFG,1585106331,8,5,0.79,False,https://www.youtube.com/watch?v=wfDAcuSMSZo&t,
36,This is proof that China stole the virus from Canada and unleashed it in China so they don’t look suspect. If they unleash it on their own soil then no one will fully blame them,its_kol,1584798414,5,8,0.85,False,https://youtu.be/g7fWLs6pl78,
37,I have created 57 pie charts for each state and territories in the US to understand the current situation better,The_Coding_Yogi,1586979157,3,6,0.86,False,https://www.reddit.com/r/Covid19Conspiracy/comments/g1q7k9/i_have_created_57_pie_charts_for_each_state_and/,"I have created this website to display the data in as simplest format as possible and I have added many graphs to achieve that.

Today I came up with this idea of creating **pie charts** to show the current situation in the US. I have created 57 pie charts that includes **total tests, positives, negatives,  deaths and active cases.** I thought this will give people more understanding of the data.

USA Pie Charts link: [https://www.yogeshchauhan.com/Projects/COVID-19/Graphs/USA/coronavirus-us-states-pie-charts.php](https://www.yogeshchauhan.com/Projects/COVID-19/Graphs/USA/coronavirus-us-states-pie-charts.php)

Looking forward to your suggestions. Stay safe people!"
38,7 billion vs 20 assholes,tllnz,1586854004,0,5,1.0,False,https://www.reddit.com/r/Covid19Conspiracy/comments/g0vi9l/7_billion_vs_20_assholes/,Surely there's enough of us that we can outwit those who have us in this matrix of fear and delusion. Come on!
39,"Searched ""proof covid 19 was..."" on google. every initial result emphasizes evidence it's not man made.",vivalabunny,1586368483,4,6,0.86,False,https://i.redd.it/eyzqwt4tgkr41.jpg,
40,The Invisible Enemy,porcaja,1586164488,7,5,0.78,False,https://www.reddit.com/r/Covid19Conspiracy/comments/fvpen2/the_invisible_enemy/,Would anyone like to compare and contrast as to why Donald Trump keeps referring to the virus as such and potential deeper meanings? Pedophile rings being exposed? Time traveling trump? Let’s lay it all out...
41,Donald J Trump,McDermond,1586143529,6,6,0.88,False,https://www.reddit.com/r/Covid19Conspiracy/comments/fvjlqr/donald_j_trump/,"took the Oath of Office, swearing his fiduciary responsibility to put the interest of the nation above his own. He misled the nation for months about COVID-19 to protect his candidacy for re-election. The Trump Epidemic has cost thousands of lives. By the end of the coming week, the Trump Epidemic will have killed more than at Pearl Harbor and on 9/11 COMBINED. Yet, this man brags about his press briefings gaining higher ratings than other TV shows. Think about that."
42,"Both videos recorded in last 48 hours, thoughts ?",Tyler-Bender,1586126393,2,4,0.81,False,https://v.redd.it/6uxq8mlwg0r41,
43,3D printing saving lives!,BanditMFG,1584386527,0,7,1.0,False,https://twitter.com/michalnaka/status/1239316241984049152?s=21,
44,Duuuuuuuude! What if COVID-19 came from glaciers/icebergs?,chan128,1586720695,8,5,0.69,False,https://www.reddit.com/r/Covid19Conspiracy/comments/fzvbpm/duuuuuuuude_what_if_covid19_came_from/,"Okay, hear me out.... 
What if COVID-19 came from glaciers and icebergs? 

prehistoric viruses are still frozen within the icebergs, and scientists have discovered 28 new viruses just from sampling an ice berg. I mean, think about it, climate change hit harder than ever this year; a ton of ice melted and polar bears are going extinct because  their cold environment is slowly disappearing. It makes sense for Wuhan China to be hit first with COVID-19 because they eat more fish than any other country. The fish could have been  contaminated with the virus previously due to the virus spreading throughout the water and through its gills. Once a person eats the fish, he/she is overcome by the virus. 

What is everyone’s thoughts?"
45,Questionable,Jackariah_N,1586604859,1,5,1.0,False,https://www.reddit.com/r/Covid19Conspiracy/comments/fyvns3/questionable/,Anyone else off put by ads using corona to get u to buy their shit?
46,What if China wasn’t lying when they spoke about the US Military being the cause of the pandemic? That could be why billionaires like Bill Gates and others started eating up stocks in companies that mainly make vaccine?,the-tv-master,1586081301,1,5,0.87,False,https://www.reddit.com/r/Covid19Conspiracy/comments/fv5zuk/what_if_china_wasnt_lying_when_they_spoke_about/,
47,"Not a single plane Australian owned is flying over the biggest island on the planet. The skies are so quiet, it's fucking scary",Lou_suphar,1585430782,1,5,1.0,False,https://www.reddit.com/r/Covid19Conspiracy/comments/fqk57s/not_a_single_plane_australian_owned_is_flying/,
48,.... how using data manipulation in combination with controversial scientific data presentation could easily cause catastrophic panic in modern society,vstoykov,1585203852,2,6,1.0,1585576057.0,https://www.reddit.com/r/Covid19Conspiracy/comments/fozm31/how_using_data_manipulation_in_combination_with/,"I received link to this PDF containing something that looks like a conspiracy theory.

I downloaded the file form gofile.io?c=xTregM and made it available on IPFS  [QmfZvW4KsKaAdh7MWXyf4auEYVr2Qn59JpWABWnw6SqzzX](https://gateway.pinata.cloud/ipfs/QmfZvW4KsKaAdh7MWXyf4auEYVr2Qn59JpWABWnw6SqzzX) just in case it's deleted.

The metadata of the file looks cleaned (except ""Google""). Data from the host (from which I downloaded it):

`Name New flu data observations.pdf`  
`Size 1.8 MiB`  
`MD5 f0f0dee2bc6827c70e1dae6d48680492`  
`Type application/pdf`
 `2020-03-25 14:25:43`

Some interesting quotes from the PDF:

>On the next pages we will use a financial index (we selected Dow but could be any) to illustrate how using data manipulation in combination with controversial scientific data presentation could easily cause catastrophic panic in modern society.

>We consider WHO practices of not reporting the number of tested individuals as manipulative.  
>  
>If WHO and other groups have not used data in analytical models, based on population density and other geographical factors, to track the spread of a disease (not only this particular flu), should be considered as a not  scientific.  
>  
>Viruses does not have an idea for our political boundaries!

I don't know the motivation of the creator of this conspiracy theory. He is using ""we"" pronoun. Maybe there are multiple authors.

Some hypotheses:

- It's a global warming fanatic spreading misinformation to kill as many people possible (""humanity is a virus, the COVID-19 is the cure"") - the same type of people spreading anti-vaxer propaganda on purpose.

- Someone just want to receive donations from conspiracy theory fans

- Genuine conspiracy theorist that thinks he is doing good by exposing the evil conspiracy to create panic for financial gain (by using financial instruments like options, short selling of stocks, etc).

- Government-paid actors spreading misinformation to harm the enemy. This is extremely dumb, because memetic weapons like this can (and often do) backfire.

- Side project by Google employees?"
49,COvid-19 on the deep web.,NickNoir2,1584766421,2,5,0.76,False,https://www.reddit.com/r/Covid19Conspiracy/comments/fm2jr8/covid19_on_the_deep_web/,"Do you have any information about the COvid-19 talking on the deep web? 

Probably real numbers as at the very beginning of the spread in china people said that the official numbers were wrong. 

I don't know what kind of information we can get from the deep web chans forums."
50,Is the reaction to Covid-19 an experiment to help prevent a climate change catastrophe?,nerill,158474023,6,6,0.88,False,https://www.reddit.com/r/Covid19Conspiracy/comments/flv5gp/is_the_reaction_to_covid19_an_experiment_to_help/,"After 9/11, when air travel was greatly curtailed, there was short term drop in the gases that effect the climate. It was a fairly short period so the results were inconclusive. Now that the global response to Covid-19 has continued for a longer period of time, and expected to go on for weeks or even months, has already made a considerable positive effect on the causes of climate change. (before I continue,  I am certain Covid-19 is real and harmful and not itself a man made experiment). As a mind game, I thought it would be a genius secret experiment or even response to climate change that everyone unknowingly buys into. There is no left/right wing politics, no big oil/progressives arguments all for someones own personal benefit. But, everyone cares about their health and will do almost anything to protect it. So, what better way to bring a collective mindset to combat what could be the man made world ending crises.

It was all just a mind game for me until I commented/joked to a CBC article about how the Covid-19 reaction is drastically reducing climate change emissions. The article:  [https://www.cbc.ca/news/technology/covid-19-air-pollution-1.5501810?\_\_vfz=medium%3Dtray\_notification#](https://www.cbc.ca/news/technology/covid-19-air-pollution-1.5501810?__vfz=medium%3Dtray_notification#) 

My Comment: 

https://preview.redd.it/ybjec70yytn41.png?width=1021&format=png&auto=webp&s=fd7f68387da216ea1ae255566cbfad0b2f8249e7

So after a few minutes and even a couple of likes, ""Content Disabled."" Humph. Oh!

Wanted to publish this somewhere just in case several large black SUVs containing large sunglassed men roar up to my door.

Maybe is really is only just a mind puzzle: I hope."
51,Blatant CCP influenced censorship on r/COVID19,BanditMFG,1584204274,0,7,1.0,False,/r/Covid2019/comments/fidbzf/blatant_ccp_influenced_censorship_on_rcovid19/,
52,I really think they should cancel the Olympics. What do you think?,BanditMFG,1584029621,0,6,0.84,False,https://japantoday.com/category/politics/update1-olympics-who-pandemic-declaration-won%27t-change-tokyo-games-plan-suga,
53,Arrested,TerribleProfession2,1583938917,1,5,1.0,False,https://www.reddit.com/r/Covid19Conspiracy/comments/fgt4o6/arrested/,https://www.justice.gov/opa/pr/harvard-university-professor-and-two-chinese-nationals-charged-three-separate-china-related
54,Coronavirus Update - Chinese Study finds COVID19 Can Float In The Air For 30 Minutes!,BanditMFG,1583905558,2,5,1.0,False,https://www.youtube.com/watch?v=cM1z8VZ2zpY,
55,"Coronavirus: Iran reports over 1,000 new cases, death roll rises to 145",BanditMFG,1583614243,0,6,1.0,False,https://www.scmp.com/news/world/middle-east/article/3074093/coronavirus-iran-reports-over-1000-new-cases-death-roll,
56,How Covid-19 Enters your body,AxcelMartinez,1586918377,0,6,0.84,False,https://www.youtube.com/watch?v=_VvonOWyshk&feature=youtu.be,
57,More Covid Opportunism - Accusations of Forceful evictions of Africans in China,tootootaa,1586665796,0,3,1.0,False,https://www.youtube.com/watch?v=CvFFUl2fxmU,
58,Face mask,redthattt,1586598665,2,4,1.0,False,https://www.reddit.com/r/Covid19Conspiracy/comments/fyu0zs/face_mask/,"I want to know why I keep seeing videos of people getting a ticket for not wearing a mask.
What if people can’t find them at a store or afford an expensive ass mask online , the price for them is ridiculous & I I don’t think it’s right. 
Why don’t cops start handing them out instead of ticketing?? I don’t get it bro, even in this situation money is the motive??????"
59,"Questions, thoughts and ramblings",gsabato,1586188857,1,4,0.71,1586160310.0,https://www.reddit.com/r/Covid19Conspiracy/comments/fvupk6/questions_thoughts_and_ramblings/,"So I've pretty much stayed away from any conspiracy type news stories, forums etc.. regarding the WuFlu. I did this for a very good reason. I felt that something wasn't right about this whole situation from the beginning but wanted to form some opinions based on what I was actually seeing with my own eyes rather than be influenced by others thoughts and experiences. So here are a few things I noticed and a few questions I have regarding those observations:

1. At the time of this post there have been  1,772,369 covid19 tests performed with  336,830 tests coming back positive. So 81% of tests have come back negative, in raw numbers that's 1,435,539 negative results. So my first questions is what was wrong with these almost 1.5 million people? It isn't exactly easy to get a test, certain criteria must be met and early on that criteria was even more stringent.
2. Assuming the above percentages are correct that means that only 20% of people the CDC considers to be high risk for contracting the virus and have displayed some symptoms actually have this virus. Since only 20% of those considered high risk are testing positive I think it would be very very conservative to assume that less than 20% of the population will end up with the virus. With the US population being around 328 million that would mean that around 65 million people would be the high end for those actually catching this virus. Of that 65 million many will experience no symptoms or mild symptoms. In fact only about 5% of those testing positive end up being hospitalized and a small percentage of those hospitalized will die. So we can assume about 3.25 million people will be hospitalized. A fair assumption would be that  about 10% of those 3.25 million will not recover. That would put a death toll of around 325,000. A large number but a very small percentage. Again I think these numbers are very high and many other factors need to be taken in to account. For instance, how many of these people would have died from another cause? So my question is why are we shutting the entire country down for such a small mortality rate?

I have other questions but these are the two big things that I just can't seem to wrap my head around. Am I missing something? Is my logic flawed?"
60,What if...?,McDermond,158591033,9,5,0.81,False,https://www.reddit.com/r/Covid19Conspiracy/comments/fu02bb/what_if/,Trump imposes martial law to suspend the elections in November?
61,Can someone find this video? It keeps getting taken down...,xG3orG3x,1585707481,11,4,1.0,False,https://i.redd.it/ptmsypfbv1q41.jpg,
62,Cvoid 19 cover up/conspiracy... Lets hear it,tricksandtreats24,1585486108,12,5,0.85,False,https://www.reddit.com/r/Covid19Conspiracy/comments/fr03ka/cvoid_19_cover_upconspiracy_lets_hear_it/,"Cvoid 19 is a new form of population control. How many times has the government supported something that's harmful to citizens. Drugs, gang activity, (early times) tobacco, not getting married (being taxed too much money). All these things contribute to one thing population control. US literally had a perfect example of what's going to happen (China) yet we sat around and did nothing. They're supporting cvoid 19 being brought into the US and is going to be killing us softly ....."
63,Saw this coming a mile off...DOJ edges on martial law,McDermond,1584881385,0,3,1.0,False,https://www.reddit.com/r/Covid19Conspiracy/comments/fmu8zb/saw_this_coming_a_mile_offdoj_edges_on_martial_law/,[https://www.washingtonpost.com/national-security/us-intelligence-reports-from-january-and-february-warned-about-a-likely-pandemic/2020/03/20/299d8cda-6ad5-11ea-b5f1-a5a804158597\_story.html](https://www.washingtonpost.com/national-security/us-intelligence-reports-from-january-and-february-warned-about-a-likely-pandemic/2020/03/20/299d8cda-6ad5-11ea-b5f1-a5a804158597_story.html)
64,Coronavirus Update - Are you ready? COVID19 is NOT the Flu!,BanditMFG,1583563665,0,3,1.0,False,https://youtu.be/yRavNcRoJvE,
65,46 new infections today. This brings the total in The Netherlands to 128!,BanditMFG,1583545158,0,4,1.0,False,https://i.redd.it/0dxb8rsi93l41.jpg,
66,Coronavirus Update - SCov and LCov: The 2 COVID19 Strains,BanditMFG,1583460715,0,4,0.99,False,https://www.youtube.com/watch?v=LTW--rpntWY&feature=share,
67,The total confirmed cases in The Netherlands just jumped to 82! 44 new cases today.,BanditMFG,1583447766,0,4,0.84,False,https://i.redd.it/typhzvlu7vk41.jpg,
68,"If you haven’t watched this bit of investigative journalism, please take the time to understand the clues on where this virus originated.",Beepboopcomrad,1587427781,0,3,0.67,False,https://youtu.be/3bXWGxhd7ic,
69,Be open. Not the usual conspiracy theory without foundations.,malakistiri,1587182618,1,3,1.0,False,https://www.youtube.com/watch?v=1BiM1YYIPCo,
70,I have created a compete dashboard for US COVID-19 cases tracking.,The_Coding_Yogi,1587172279,1,3,1.0,False,https://www.reddit.com/r/Covid19Conspiracy/comments/g364lc/i_have_created_a_compete_dashboard_for_us_covid19/,"&#x200B;

[US Dashboard for COVID-19 Tracking](https://reddit.com/link/g364lc/video/njw85jfuuet41/player)

The complete Dashboard: [https://www.yogeshchauhan.com/Projects/COVID-19/coronavirus-us-live-dashboard-by-yogesh-chauhan.php](https://www.yogeshchauhan.com/Projects/COVID-19/coronavirus-us-live-dashboard-by-yogesh-chauhan.php)

I have created this website to display the data in as simplest format as possible and I have added many graphs to achieve that.

Today I came up with this idea of creating a DASHBOARD. It has pie charts with population and with cases that makes the picture very clear.

Also, 7 days and 30 days line charts and column charts shows what's the recovery speed and what's the spread speed.

At the end, it has most affected states and counties tables with the full table links.

Looking forward to your suggestions. Stay safe people!"
71,"I have created a timeline for historic data of COVID-19 cases, recoveries and deaths for each country. Looking forward to suggestions and feedback. Thank you and stay safe!",The_Coding_Yogi,1586719519,4,3,1.0,False,https://www.reddit.com/r/Covid19Conspiracy/comments/fzv37f/i_have_created_a_timeline_for_historic_data_of/,"&#x200B;

[COVID-19 Timeline for US and Global yogeshchauhan.com](https://preview.redd.it/752syctkgds41.png?width=2053&format=png&auto=webp&s=6072189442d923c9411395b31f6983e53b051859)

I have created this website to display the data in as simplest format as possible and I have added many graphs to achieve that.

Today I came up with this idea of creating a timeline to show the daily picture of what's going on. Rather than a table (which is already available on my website), I thought this will give people more understanding of the historic data.

You can go to the global view using this link: [https://www.yogeshchauhan.com/Projects/COVID-19/coronavirus-global-live-tracker-by-yogesh-chauhan.php](https://www.yogeshchauhan.com/Projects/COVID-19/coronavirus-global-live-tracker-by-yogesh-chauhan.php)

and just click on ""timeline"".

USA direct link: [https://www.yogeshchauhan.com/Projects/COVID-19/country-timeline.php?country\_name=USA](https://www.yogeshchauhan.com/Projects/COVID-19/country-timeline.php?country_name=USA)

Looking forward to your suggestions. Stay safe people!"
72,All Covid19 Conspiracies,millieadrian,1586405717,2,3,1.0,False,https://www.reddit.com/r/Covid19Conspiracy/comments/fxdwwd/all_covid19_conspiracies/,"I've heard a few interesting conspiracy theories when it comes to the Coronavirus (COVID-19) and it got me wondering. What other conspiracies are out there!? I want to make a YouTube video on some of the craziest, most intriguing theories so do what you do best Reddit. Lay em on me! Show me some head-scratchers! :)"
73,For those saying Dr. Cameron Kyle-Sidell was a fake doctor feeding conspiracies,malakistiri,1586400602,2,3,1.0,False,https://www.medscape.com/viewarticle/928156,
74,My conspiracy theorist friend thinks the Corona-virus is man-made. Any thoughts?,vivalabunny,1586361618,2,3,1.0,False,/r/conspiracytheories/comments/ezuitv/my_conspiracy_theorist_friend_thinks_the/,
75,"LA Times: ""Hospitals say feds are seizing masks and other coronavirus supplies without a word"".",McDermond,158633523,0,3,1.0,False,https://www.reddit.com/r/Covid19Conspiracy/comments/fwwduc/la_times_hospitals_say_feds_are_seizing_masks_and/,[https://www.latimes.com/politics/story/2020-04-07/hospitals-washington-seize-coronavirus-supplies](https://www.latimes.com/politics/story/2020-04-07/hospitals-washington-seize-coronavirus-supplies)
76,The u.s election,bobturkish,1586134002,0,3,1.0,False,https://www.reddit.com/r/Covid19Conspiracy/comments/fvgtqp/the_us_election/,I was thinking how odd all this is with the election coming up
77,Event 201,nikswa675,158608608,3,3,1.0,False,https://www.reddit.com/r/Covid19Conspiracy/comments/fv736x/event_201/,"http://www.centerforhealthsecurity.org/event201/about


This exercise was performed in New York City on October 18, 2019. I copied a part of the web page for you to get an idea. I have never heard of an exercise such as this before? Has anyone?


About the Event 201 exercise

Event 201 was a 3.5-hour pandemic tabletop exercise that simulated a series of dramatic, scenario-based facilitated discussions, confronting difficult, true-to-life dilemmas associated with response to a hypothetical, but scientifically plausible, pandemic. 15 global business, government, and public health leaders were players in the simulation exercise that highlighted unresolved real-world policy and economic issues that could be solved with sufficient political will, financial investment, and attention now and in the future.

The exercise consisted of pre-recorded news broadcasts, live “staff” briefings, and moderated discussions on specific topics. These issues were carefully designed in a compelling narrative that educated the participants and the audience.

The Johns Hopkins Center for Health Security, World Economic Forum, and Bill & Melinda Gates Foundation jointly propose these recommendations."
78,Criminalizing Dissent,mindputty,1585746807,0,2,1.0,False,https://www.reddit.com/r/Covid19Conspiracy/comments/fst9kx/criminalizing_dissent/, [https://www.nationalobserver.com/2020/03/13/analysis/truth-about-coronavirus-scary-global-war-truth-even-scarier](https://www.nationalobserver.com/2020/03/13/analysis/truth-about-coronavirus-scary-global-war-truth-even-scarier)
79,Coronavirus Update - 1.5m Distance Is Not Enough,BanditMFG,1585696979,1,3,0.81,False,https://www.youtube.com/watch?v=888CIU-6ALg&feature=share,
80,Wtf-Covid -Sarin,surfward,1585388351,0,3,0.8,False,https://i.redd.it/u1wud9vbibp41.jpg,
81,COVID19 Where's the proof?,chriztaphason,1585326431,7,3,0.67,False,https://www.reddit.com/r/Covid19Conspiracy/comments/fptd2p/covid19_wheres_the_proof/,"HOW MANY INFECTED HAVE YOU SEEN?
There's something Fishy going on here!
A way to brace the public without causing full blown
pannic! A misdirection if you will to prepare us yet avert our eyes from the true impact of something far worse than the flu!
Any number of things.
1. Environmental 
2. Economical
3. Food shortage"
82,Understanding of general population of COVID-19 and the measures people are taking on a daily basis to prevent spreading it. (Takes <5 minutes). Thank you for your contribution and stay safe!,coldblood91,1585285256,0,3,1.0,False,https://transplant.typeform.com/to/SsfSwx,
83,CORONAVIRUS UPDATE - The Dutch Almost Reached ICU Capacity - Will New Stricter Measures Be Enough?,BanditMFG,1585187583,0,2,0.67,False,https://www.youtube.com/watch?v=Zns2udjZdQI,
84,This,12sushi,158514111,0,3,1.0,False,https://www.thedailybeast.com/jailed-harvey-weinstein-tests-positive-for-coronavirus-report,
