,Title,Author,Created,Comments,Score,Upvote,Edited,Url,Body
0,Mark Cuban says bailed out companies should never be allowed to buy back their stocks ever again,SingularityWalker,1584607344,1336,99212,0.94,False,https://www.cnbc.com/2020/03/18/mark-cuban-says-bailed-out-companies-should-never-be-allowed-to-buy-back-their-stocks-ever-again.html,
1,"White House advisor Dr. Fauci works 20-hour days and his wife reminds him to eat, sleep and drink water",waffle-fil-a,1585879937,3000,83941,0.93,False,https://www.cnbc.com/2020/04/02/white-house-advisor-anthony-faucis-wife-on-his-hectic-schedule.html,
2,Bill Gates says the US missed its chance to avoid coronavirus shutdown and businesses should stay closed,UteForLife,1585102807,3174,80735,0.89,False,https://www.cnbc.com/2020/03/24/bill-gates-us-missed-its-chance-to-avoid-coronavirus-shutdown.html,
3,"For the first time in US history, every state is under a disaster declaration simultaneously",into_the_space,1586659289,3042,78568,0.94,False,https://www.cnn.com/world/live-news/coronavirus-pandemic-04-11-20/h_a72269d9659294b60f09c1eb6acec702,
4,Just a reminder that during the Ebola crisis Dr. Fauci suited up personally to take care of an infected patient.,geENTics,1585891982,1520,66995,0.93,False,https://www.bloomberg.com/news/videos/2019-05-22/david-rubenstein-show-anthony-fauci-video,
5,Texas judge rules all registered voters can vote by mail if they fear catching coronavirus,milkprogrammer,158720102,304,60644,0.93,False,https://www.cnn.com/2020/04/17/politics/texas-voting-by-mail-disability-coronavirus/index.html,
6,Fauci: 'I don't understand why' every state hasn't issued stay-at-home orders,dv8silencer,158590748,339,55094,0.94,False,https://www.cnn.com/2020/04/02/politics/fauci-stay-home-coronavirus-states-cnntv/index.html,
7,Coronavirus conference cancelled due to coronavirus.,Thom803,158392615,1054,50973,0.96,False,https://www.bloomberg.com/news/articles/2020-03-10/coronavirus-conference-gets-canceled-because-of-coronavirus,
8,Miss England hangs up her crown to return to work as doctor during coronavirus pandemic,allicat83,1586217699,936,45954,0.92,False,https://edition.cnn.com/2020/04/06/uk/miss-england-coronavirus-doctor-scli-intl-gbr/index.html,
9,"Florida man buys $20,000 bottle of bourbon for $40,000 to help struggling restaurant stay afloat",hausomad,1586892942,1470,45137,0.91,False,https://www.cnn.com/2020/04/13/us/florida-veteran-bourbon-datz-restaurant-trnd/index.html,
10,"The Japanese government has announced that the reselling of masks for profit will become a crime punishable by a one-year jail term or a 1m-yen fine ((£7,320; $9,560) - or both.",TheJeck,1583863732,1695,44308,0.97,False,https://www.bbc.co.uk/news/live/world-asia-51811969?ns_mchannel=social&ns_source=twitter&ns_campaign=bbc_live&ns_linkname=5e6761cbc429ed066b591df8%26Japan%20cracks%20down%20on%20mask%20profiteering%262020-03-10T09%3A51%3A05.135Z&ns_fee=0&pinned_post_locator=urn:asset:6310ed3b-f22b-4fdf-a219-b18f2e7bee28&pinned_post_asset_id=5e6761cbc429ed066b591df8&pinned_post_type=share,
11,Tom and Rita Hanks have been released from the hospital!,Depraved_Reaper,1584444444,1197,42120,0.88,False,https://www.cnn.com/2020/03/16/entertainment/tom-hanks-rita-wilson-released-hospital-coronavirus/index.html,
12,"Fauci: If Covid-19 mitigation efforts started earlier, ""you could have saved lives""",into_the_space,1586729849,3111,42056,0.86,False,https://www.cnn.com/world/live-news/coronavirus-pandemic-04-12-20/h_bd88a9d5d74575d502d005794d2d054d,
13,"Amazon has suspended 6,000 seller accounts globally for coronavirus price gouging",into_the_space,1587071405,1390,41744,0.95,False,https://www.cnn.com/world/live-news/coronavirus-pandemic-intl-04-16-20/h_97006ee186e6965d405e048f93532388,
14,PM Johnson admitted to hospital over virus symptoms,MichelleUprising,158614661,1706,40376,0.94,False,https://www.bbc.co.uk/news/uk-52177125,
15,"FDA tells Alex Jones to stop promoting unapproved, misbranded coronavirus cures online",mchamst3r,1586509735,488,35329,0.92,False,https://www.washingtonpost.com/world/2020/04/08/coronavirus-latest-news-2/?1/#link-XK5RW4ZS5BHIVJR2YLPOZIPA2A,
16,"A Georgia bar owner removed $3,714 worth of bills stapled to the walls to give to her unemployed staff",womannotmother,1586457879,1036,34735,0.94,False,https://www.cnn.com/2020/04/08/us/sand-bar-dollar-bills-donation-trnd/index.html,
17,"NYC ER doctor: The lack of US testing is a ""National Scandal""",joemeni,1583186873,2475,34118,0.91,False,https://www.cnbc.com/video/2020/03/02/coronavirus-testing-emergency-room-doctor-cdc-department-health-squawk-box.html,
18,White House falsely claims the coronavirus has been 'contained' in the US,SeventhConstellation,158362629,60,33544,0.87,False,https://edition.cnn.com/2020/03/07/politics/fact-check-white-house-coronavirus-contained/index.html,
19,Amazon fires warehouse worker who led Staten Island strike for more coronavirus protection,MyStolenCow,1585645063,379,33160,0.94,False,https://www.cnbc.com/2020/03/30/amazon-fires-staten-island-coronavirus-strike-leader-chris-smalls.html,
20,"Fauci calls for social distances until there is zero new cases, zero deaths",Snipuh21,1585968739,1465,31689,0.9,False,https://www.washingtonpost.com/world/2020/04/01/coronavirus-latest-news/,
21,"Boy, 7, uses $600 of savings to make coronavirus care packages for seniors, feed 90 students",noahsurvived,1584743944,772,31657,0.89,False,https://www.foxnews.com/us/coronavirus-maryland-boy-carepackages-seniors-feed-students,
22,‘Stupid and crazy’: Local officials protest Gov. Kemp’s decision to reopen beaches in hard-hit Georgia,icedpickles,1586199942,1202,31348,0.95,False,https://www.washingtonpost.com/nation/2020/04/06/tybee-island-kemp-coronavirus/,
23,"Dr. Fauci: 'You don't make the timeline, the virus makes the timeline'",chickspeak,158522585,1481,28463,0.95,False,https://www.cnn.com/videos/us/2020/03/26/dr-anthony-fauci-virus-makes-the-timeline-cpt-vpx.cnn,
24,"Pastor again defies state order not to hold large gatherings. He says 1,000 people came to his church Sunday",LogicUpgrade,1585594723,2523,27355,0.96,False,https://edition.cnn.com/2020/03/24/us/louisiana-pastor-spell-coronavirus/?hpt=ob_blogfooterold,
25,"Truckers brave coronavirus outbreak to deliver goods: ""If we stop, the world stops""",hildebrand_rarity,1584923573,1011,26565,0.97,False,https://www.usatoday.com/story/news/nation/2020/03/22/trying-buy-tiolet-paper-us-truck-drivers-have-your-back/2865277001/,
26,Fauci said he tested negative for coronavirus Saturday,mclardass,1586163392,743,26352,0.96,False,https://www.cnn.com/2020/04/05/politics/fauci-coronavirus-test-negative/index.html,
27,"China hid extent of coronavirus outbreak, US intelligence reportedly says",UteForLife,1585787647,1408,21337,0.89,False,https://www.cnbc.com/2020/04/01/coronavirus-china-hid-extent-of-outbreak-us-intelligence-reportedly-says.html,
28,College Students aged 18-24 who have been claimed as a dependent will not receive stimulus checks,Anymeans6,1585387338,3414,20238,0.96,False,https://www.forbes.com/sites/kellyphillipserb/2020/03/27/high-schoolers--college-students-may-not-be-eligible-for-stimulus-checks/#c0ab2c519da4,
29,GM’s CEO Offers to Make Ventilators in WWII-Style Mobilization,HugeDetective0,1584600431,1028,18902,0.98,False,https://www.bloomberg.com/news/articles/2020-03-18/kudlow-says-gm-ceo-offered-to-make-ventilators-for-outbreak,
30,"Senate Democrats propose canceling $10,000 in student debt for all borrowers amid coronavirus",AmericanBornChink,1584675623,1879,18331,0.9,False,https://www.cnbc.com/2020/03/19/democrats-propose-10000-in-student-debt-forgiveness-amid-coronavirus.html,
31,4 In 5 Americans Want Cities Quarantined In Case Of Coronavirus Outbreak,BrakemanBob,1583202969,2015,18044,0.93,False,https://www.forbes.com/sites/kenrapoza/2020/02/29/build-the-virtual-wall-4-in-5-say-countries-should-quarantine-coronavirus-cities/,
32,"First U.S coronavirus case of unknown origin confirmed in Northern California, a sign the virus may be spreading in a local area",poklane,158278991,1655,17340,0.96,False,https://www.washingtonpost.com/world/asia_pacific/coronavirus-china-live-updates/2020/02/26/f889693a-580e-11ea-9000-f3cffee23036_story.html,
33,"US reports most coronavirus deaths in one day as 1,224 die on Saturday",dontovercommit,1586080261,2146,17266,0.97,False,http://edition.cnn.com/world/live-news/coronavirus-pandemic-04-05-20/index.html,
34,"‘We hear you, dad': A daughter stays on the phone for hours and hours as her father dies alone from coronavirus",psuyg,1587334893,462,17142,0.96,False,https://www.usatoday.com/story/news/nation/2020/04/19/coronavirus-deaths-daughter-listens-hours-father-dies-alone/2986665001/,
35,Doctor's message to her kids: 'If they lose me to COVID I want them to know Mommy tried really hard',allicat83,1585964651,476,16409,0.95,False,https://www.cnn.com/2020/04/03/us/mom-ppe-photo-trnd/index.html,
36,White House rejects bailout for U.S. Postal Service battered by coronavirus,Zhana-Aul,158665214,541,16321,0.96,False,https://www.washingtonpost.com/business/2020/04/11/post-office-bailout-trump/,
37,"James Dyson designed a new ventilator in 10 days. He's making 15,000 for the pandemic fight",iends,1585257645,762,16264,0.96,False,https://www.cnn.com/2020/03/26/tech/dyson-ventilators-coronavirus/index.html,
38,"Similarly to Patient 31 in South Korea, one reckless infected person was solely responsible for a major Covid19 infection in Uruguay. She was not feeling well after coming home from Italy and Spain and still attended a wedding on March 7th with 500 other people. She is currently being sued. [ENG]",kunigunde-mauer,1584691225,625,15857,0.99,False,https://www.theguardian.com/world/2020/mar/19/uruguay-coronavirus-party-guest-argentina,
39,Top US infectious diseases expert calls for a federally mandated stay-at-home order,into_the_space,1585903388,969,15000,0.97,False,https://www.cnn.com/world/live-news/coronavirus-pandemic-04-02-20-intl/h_7928afb03efd8f4c7c7e3299663712a4,
40,"Italy saw the smallest increase in new cases since its outbreak began, and there were nearly as many recoveries as new infections in the past 24 hours",iosonodavide,1585615628,824,14733,0.98,False,https://edition.cnn.com/world/live-news/coronavirus-outbreak-03-30-20-intl-hnk/h_06feee39fa5d282b38f091cdce722abd,
41,Newest Shortage in New York: The City Is Running Out of Dogs [and also cats] to Adopt [After a Surge in Adoption/Fostering Applications],Gayfetus,1585190407,502,14213,0.97,False,https://www.bloomberg.com/news/articles/2020-03-25/newest-shortage-in-new-york-the-city-is-running-out-of-dogs,
42,"Economic Shutdown Is Estimated to Save 600,000 American Lives",mepper,1585084142,1726,14162,0.97,False,https://www.bloomberg.com/news/articles/2020-03-23/economic-shutdown-is-estimated-to-save-600-000-american-lives,
43,The Workers Who Supply the World’s Food Are Starting to Get Sick,BitcoinBoffin,1585514874,1283,13663,0.96,False,https://www.bloomberg.com/news/articles/2020-03-27/food-workers-getting-sick-is-the-latest-threat-to-world-supply,
44,Coronavirus: 36% Of Americans Say Pandemic Has Made A ‘Serious Impact’ On Their Mental Health,MinimumRaccoon8,1586043063,821,13089,0.97,False,https://www.forbes.com/sites/carlieporterfield/2020/04/02/coronavirus-36-of-americans-say-pandemic-has-made-a-serious-impact-on-their-mental-health/,
45,"Michigan stay-at-home order now bans visits to friends, relatives, governor says",Bindingrules,1586634356,1644,12278,0.96,False,https://www.foxnews.com/politics/michigan-stay-at-home-order-now-bans-visits-to-friends-relatives-governor-says,
46,"Home Depot executes 'stop-sale' order for N95 masks, donates them to health care workers during coronavirus",helpmeredditimbored,1585828449,638,12120,0.98,False,https://www.usatoday.com/story/money/2020/04/01/home-depot-n-95-respirators-masks-coronavirus-covid-19/5101861002/,
47,Boris Johnson discharged from hospital,Bobo-Twix,1586723977,445,12055,0.93,False,https://www.bbc.co.uk/news/uk-politics-52262012,
48,Experts tell White House coronavirus can spread through talking or even just breathing,Gandalfsmother,1585857973,1786,12031,0.98,False,https://www.cnn.com/world/live-news/coronavirus-pandemic-04-02-20-intl/h_1ddd8f1a1526b889df5a51281b593c4c,
49,Coronavirus: American Airlines' first cargo-only flight in 35+ years carries medical gear,johntwit,1584868608,247,11931,0.98,False,https://www.usatoday.com/story/travel/2020/03/21/coronavirus-american-airlines-first-cargo-only-flight-35-years/2891162001/,
50,Students across the US are being asked to work remotely. But 22% of homes don't have internet,Nihilist911,1584987997,1031,11596,0.96,False,https://www.theguardian.com/commentisfree/2020/mar/23/us-students-are-being-asked-to-work-remotely-but-22-of-homes-dont-have-internet,
51,Upcoming job losses will be unlike anything the US has ever seen,wolfsog23,1584732191,1917,11534,0.97,False,https://www.cnbc.com/2020/03/20/the-upcoming-job-losses-will-be-unlike-anything-the-us-has-ever-seen.html,
52,A grocery clerk with cerebral palsy died of coronavirus. She had kept working to help seniors,ohnoh18,1586405743,296,11529,0.97,False,https://www.cnn.com/2020/04/08/us/coronavirus-leilani-jordan-grocery-worker/index.html,
53,"New York coronavirus cases surge 38% overnight to 20,875",UteForLife,1585005492,841,11182,0.99,False,https://www.cnbc.com/2020/03/23/new-york-coronavirus-cases-surge-38percent-overnight-to-20875.html,
54,Two black men say they were kicked out of Walmart for wearing protective masks. Others worry it will happen to them.,mchamst3r,1586465445,991,11162,0.91,False,https://www.washingtonpost.com/business/2020/04/09/masks-racial-profiling-walmart-coronavirus/?hpid=hp_hp-top-table-main_racial-8am%3Ahomepage%2Fstory-ans,
55,Idris Elba urges people not to spread conspiracy theory about black people being immune to Coronavirus,jazzerhero,1584657832,754,11144,0.98,False,https://www.cnn.com/2020/03/18/entertainment/idris-elba-coronavirus-update/index.html,
56,Boris Johnson praises immigrant nurses who saved his life,dingo_dollar,1586847659,510,11136,0.95,False,https://www.washingtonpost.com/world/europe/boris-johnson-nurses-nhs/2020/04/13/51498d34-7bfa-11ea-a311-adb1344719a9_story.html?outputType=amp,
57,Pentagon confirms first coronavirus case at U.S. military headquarters.,AdamCannon,1585212271,382,11072,0.98,False,https://www.cnbc.com/2020/03/25/pentagon-confirms-first-coronavirus-case-at-us-military-headquarters.html,
58,"New York governor says ventilator prices went from $20,000 to $50,000 in a matter of weeks",Pun_isher,158561919,1159,10487,0.98,False,https://www.cnn.com/world/live-news/coronavirus-outbreak-03-30-20-intl-hnk/h_38745d93c4304badc708b9bddaab2a45,
59,The UK has now been locked down,ShadowAsh99,1585025209,1159,10323,0.98,False,https://www.bbc.co.uk/news/uk-52012432?at_medium=custom7&#38;at_campaign=64&#38;at_custom2=twitter&#38;at_custom3=%40BBCBreaking&#38;at_custom1=%5Bpost+type%5D&#38;at_custom4=8A28DC0E-6D45-11EA-B232-B1AF923C408C,
60,Coronavirus confirmed as pandemic,Space_Pyromaniac,1583973405,570,10155,0.98,False,https://www.bbc.co.uk/news/world-51839944,
61,Doctors disagree with White House adviser's statement that media is hyping need for protective equipment,BernCece,1585525357,177,10130,0.97,False,https://www.cnn.com/2020/03/26/politics/coronavirus-doctors-white-house/?iid=ob_article_footer_expansion,
62,Hobby Lobby FINALLY closes all stores after defying local Stay-At-Home orders,austinw24,1585979244,530,10042,0.98,False,https://www.usatoday.com/story/money/2020/04/03/coronavirus-closings-hobby-lobby-temporarily-closing-all-stores-covid-19/2943408001/,
63,4 year old with cancer recovers from Coronavirus.,AHxSAINTSxAH,1587160319,134,9770,0.97,False,https://www.bbc.co.uk/news/av/uk-52325533/coronavirus-four-year-old-boy-archie-wilks-recovers-from-covid-19,
64,"'It feels like a war zone’: As more of them die, grocery workers increasingly fear showing up at work",Gayfetus,158676383,1072,9748,0.96,False,https://www.washingtonpost.com/business/2020/04/12/grocery-worker-fear-death-coronavirus/,
65,Neurosurgeon who separated conjoined twins dies from complications of Covid-19,Smilefriend,1585630908,273,9719,0.98,False,https://us.cnn.com/2020/03/30/health/new-york-neurosurgeon-death-coronavirus-mcdonald-twins/index.html,
66,New York mandates that everyone must wear a mask,Glenrill,1586999786,867,9675,0.98,False,https://www.bloomberg.com/news/live-blog/2020-04-15/new-york-governor-cuomo-holds-coronavirus-briefing?sref=SCKvL4TY,
67,Disgraced conman and snake oil salesman televangelist Jim Bakker promoted an alleged cure to coronavirus. Missouri is now suing him.,Fitbitnitwit,158403958,417,9659,0.99,False,https://www.washingtonpost.com/nation/2020/03/11/jim-bakker-coronavirus-cure/,
68,Pentagon says it still hasn't sent ventilators because it hasn't been told where to send them,MortWellian,1585715448,713,9529,0.97,False,https://www.cnn.com/2020/03/31/politics/pentagon-ventilators/index.html,
69,"As couples self-isolate due to coronavirus, lawyers expect a rise in divorces",ihazone,1585155563,1110,9517,0.97,False,https://www.cnbc.com/2020/03/25/coronavirus-lawyers-expect-a-rise-in-divorces-after-self-isolation.html,
70,"2 Wuhan whistleblowers missing months after helping expose coronavirus outbreak, activists say",noahsurvived,1587035581,638,9503,0.95,False,https://www.foxnews.com/world/wuhan-whistleblowers-missing-exposing-coronavirus,
71,Distilleries are making hand sanitizer with their in-house alcohol and giving it out for free to combat coronavirus,os2mac,1584406453,177,9484,0.99,False,https://www.cnn.com/2020/03/16/us/distilleries-hand-sanitizer-coronavirus-trnd/index.html,
72,Air travel in the US is down 96%,adammska,1586600915,513,9473,0.98,False,https://edition.cnn.com/2020/04/09/politics/airline-passengers-decline/index.html,
73,Reddit Cofounder Alexis Ohanian Bought A Billboard In Times Square To Inform People About COVID-19,Cyruslego,1584227954,201,9420,0.97,False,https://www.forbes.com/sites/martyswant/2020/03/14/reddit-co-founder-alexis-ohanian-bought-a-billboard-in-time-square-to-inform-people-about-covid-19/,
74,"Before a Washington mother died of coronavirus, her six children used a walkie-talkie to say goodbye",allicat83,1585787451,366,9255,0.98,False,https://www.cnn.com/2020/04/01/health/us-coronavirus-sundee-rutter-death-children-walkie-talkie/index.html,
75,Amazon deleted 1 million items for price gouging or false advertising about coronavirus,princetonwu,1583207776,380,9097,0.99,False,https://www.cnn.com/2020/03/02/tech/amazon-coronavirus-products/index.html,
76,California megachurch linked to spread of more than 70 coronavirus cases | World news,Pun_isher,1585988607,356,9027,0.98,False,https://www.theguardian.com/world/2020/apr/03/california-church-coronvirus-outbreak-sacramento,
77,"A couple left a $9,400 tip at a Houston restaurant to help staff get through coronavirus shutdown",txiao007,1584513362,301,8867,0.98,False,https://www.cnn.com/2020/03/17/us/houston-restaurant-coronavirus-tip-trnd/index.html,
78,12-year-old girl with coronavirus is on a ventilator and fighting for her life,DracoTheOld,1584924418,685,8868,0.97,False,https://us.cnn.com/2020/03/22/us/georgia-coronavirus-girl-hospitalized/index.html,
79,Busch is giving 3 months' worth of beer to people who adopt or foster a dog during coronavirus crisis,dv8silencer,1585553947,422,8759,0.96,False,https://www.cnn.com/2020/03/29/us/free-busch-beer-coronavirus-dog-adoptions/index.html,
80,Walmart employee’s family files wrongful death lawsuit after man dies of coronavirus complications,noahsurvived,158624489,349,8735,0.98,False,https://www.cnbc.com/2020/04/06/coronavirus-walmart-employees-family-files-wrongful-death-lawsuit.html,
81,US State Department is preparing to raise travel advisory to highest level: DO NOT TRAVEL,lifeandmylens,1584660653,623,8690,0.99,False,https://www.cnn.com/world/live-news/coronavirus-outbreak-03-19-20-intl-hnk/h_6686b89ab86a94e40d58b80970774a64,
82,"Doctors in Brazil says death toll in Brazil is enourmosly undereported: "" The real number is much higher""",Frocharocha,1586065894,403,8615,0.98,False,https://www.theguardian.com/global-development/2020/apr/04/medics-in-brazil-fear-official-coronavirus-tally-ignores-a-mountain-of-deaths,
83,"Protesters wearing face masks and protective suits have been pictured outside Downing Street in London this morning. The group, called Pause the System, says it wants the UK government to step up its measures against coronavirus.",TheJeck,1584388167,749,8448,0.98,False,https://www.bbc.co.uk/news/live/world-51903319?ns_mchannel=social&ns_source=twitter&ns_campaign=bbc_live&ns_linkname=5e6f632a8d956f0669ae4923%26Protests%20outside%20Downing%20Street%20against%20UK%20strategy%262020-03-16T11%3A37%3A00.916Z&ns_fee=0&pinned_post_locator=urn:asset:ed94b48a-8be6-450a-8cd4-b18236cd8326&pinned_post_asset_id=5e6f632a8d956f0669ae4923&pinned_post_type=share,
84,Coronavirus might spread farther than 6 feet in the air. CDC says wear a mask in public,Wookiepuke,1585991469,1026,8285,0.98,False,https://www.usatoday.com/in-depth/news/2020/04/03/coronavirus-protection-how-masks-might-stop-spread-through-coughs/5086553002/,
85,Florida governor falsely claims the coronavirus hasn't killed anyone under 25,justalazygamer,1586517915,535,8249,0.97,False,https://www.cnn.com/2020/04/09/politics/florida-ron-desantis-false-claim-coronavirus/index.html,
86,"‘If coronavirus doesn’t get us, starvation will’: A growing number of Americans say they can’t afford to stock up on groceries",Gonzo_B,158478494,1974,8217,0.95,False,https://www.washingtonpost.com/business/2020/03/20/if-coronavirus-doesnt-get-us-starvation-will-growing-number-americans-say-they-cant-afford-stock-up-groceries/,
87,"Amazon workers to stage a walkout Monday, demanding closure of facility",jojo5346,1585567566,696,8196,0.98,False,https://edition.cnn.com/2020/03/29/tech/amazon-workers-walkout-coronavirus/index.html,
88,CDC considering recommending general public wear face coverings in public,,1585645821,1373,8017,0.99,False,https://www.washingtonpost.com/health/cdc-considering-recommending-general-public-wear-face-coverings-in-public/2020/03/30/6a3e495c-7280-11ea-87da-77a8136c1a6d_story.html,
89,‘Huge environmental waste’ as US airlines fly near-empty planes,Fr1sk3r,1587151839,382,7962,0.94,False,https://www.theguardian.com/business/2020/apr/17/us-airlines-empty-planes-coronavirus-environment,
90,China has made eating wild animals illegal after the coronavirus outbreak. But ending the trade won't be easy,Frocharocha,158672973,738,7940,0.97,False,https://www.cnn.com/2020/03/05/asia/china-coronavirus-wildlife-consumption-ban-intl-hnk/index.html,
91,WHO director faces growing calls to resign over handling of coronavirus,Smileyguy666,1586205037,69,7931,0.9,False,https://www.foxnews.com/politics/who-director-faces-growing-calls-to-resign-over-handling-of-coronavirus-china,
92,What are you waiting for?' California governor appeals to 11 states that haven't ordered residents to stay home,hash0t0,1585857241,475,7869,0.98,False,https://www.cnn.com/2020/04/02/health/us-coronavirus-thursday/index.html,
93,Man uses $900 from savings to buy gas for more than 50 Detroit nurses,allicat83,1585951396,139,7839,0.97,False,https://edition.cnn.com/2020/04/03/us/detroit-gas-nurses-trnd/,
94,"Pupil sent home for selling hand sanitiser for 50p a squirt! ""He plans to use the £9 he made to buy a kebab"".",robrobxD,1584034119,290,7812,0.98,False,https://www.bbc.co.uk/news/uk-england-leeds-51843128,
95,More than 40 employees lived at their plant for 28 days to make material to protect health care workers,Scbadiver,1587510661,121,7768,0.98,False,https://www.cnn.com/2020/04/20/us/coronavirus-workers-go-home-trnd/index.html,
96,"The coronavirus isn’t mutating quickly, suggesting a vaccine would offer lasting protection",jasonab,1585110826,459,7727,0.99,False,https://www.washingtonpost.com/health/the-coronavirus-isnt-mutating-quickly-suggesting-a-vaccine-would-offer-lasting-protection/2020/03/24/406522d6-6dfd-11ea-b148-e4ce3fbd85b5_story.html?utm_campaign=wp_news_alert_revere&utm_medium=email&utm_source=alert&wpisrc=al_science__alert-hse&wpmk=1,
97,Anthony Fauci’s security is stepped up as doctor and face of U.S. coronavirus response receives threats,PaperBoy80,1585815288,839,7676,0.98,False,https://www.washingtonpost.com/politics/anthony-faucis-security-is-stepped-up-as-doctor-and-face-of-us-coronavirus-response-receives-threats/2020/04/01/ff861a16-744d-11ea-85cb-8670579b863d_story.html,
98,Amazon workers plan strike at Staten Island warehouse to demand coronavirus protections,hash0t0,1585535446,431,7624,0.98,False,https://www.cnbc.com/2020/03/29/amazon-workers-in-staten-island-plan-strike-over-coronavirus-safety.html,
99,USA: Kansas City's WWI Museum is avoiding layoffs by giving employees thousands of pages from its archives to digitize,snihal,1585831314,155,7577,0.99,False,https://edition.cnn.com/style/article/digitize-wwi-documents-museum-trnd/index.html,
100,Los Angeles models show 95% of residents will be infected if stay-at-home order is dropped now,LegitimateVirus3,1586838256,675,7536,0.96,False,https://www.cnn.com/world/live-news/coronavirus-pandemic-04-13-20/h_847ff9be040fea8a0c6bedaa8f5bae6f,
101,"Detroit automakers shut down plants but workers may return to build ventilators - “Instead of working for profit, you’re working to help save some lives, and I think a lot of people would join in on that""",housecatspeaks,1584770241,261,7528,0.99,False,https://www.theguardian.com/us-news/2020/mar/20/detroit-automakers-shut-down-plants-workers-return-build-ventilators-coronavirus,
